stop_id,stop_code,stop_name,stop_desc,stop_lat,stop_lon,zone_id,stop_url,location_type,parent_station,stop_timezone,wheelchair_boarding,id,Name
OXFOCLA6,"1277",Oxford at 3M WB - #1277,,"43.015335","-81.185152",,,,,,false,"5",East
OXFOGM1,"1300",General Dynamics Gate 4 - #1300,,"43.01888","-81.172206",,,,,,false,"5",East
OXFOGM2,"1301",Oxford at General Dynamics Main Gate - #1301,,"43.019425","-81.170703",,,,,,false,"5",East
OXFOGM3,"1302",2035 Oxford - #1302,,"43.019868","-81.16872",,,,,,false,"5",East
OXFOHIG3,"1309",Oxford at Highbury EB - #1309,,"43.008468","-81.208349",,,,,,false,"5",East
OXFOHIG4,"1310",John Paul Secondary School WB - #1310,,"43.008983","-81.2073",,,,,,false,"5",East
OXFOIND1,"1313",Oxford east of Industrial EB - #1313,,"43.021161","-81.164167",,,,,,false,"5",East
OXFOIND2,"1314",Oxford at Industrial WB - #1314,,"43.020498","-81.166915",,,,,,false,"5",East
OXFOIND3,"1315",Oxford west of Industrial EB - #1315,,"43.020401","-81.16688",,,,,,false,"5",East
OXFOROE2,"1336",Oxford at Roehampton WB - #1336,,"43.010051","-81.203514",,,,,,false,"5",East
OXFOSEC1,"1343",Oxford at Second EB - #1343,,"43.012141","-81.19586",,,,,,false,"5",East
OXFOSEC2,"1344",Oxford at Fanshawe College Blvd WB - #1344,,"43.012511","-81.195051",,,,,,false,"5",East
OXFOTHI1,"1352",Oxford at Third EB - #1352,,"43.013429","-81.191453",,,,,,false,"5",East
OXFOTHI2,"1353",Oxford at Third WB - #1353,,"43.013802","-81.190523",,,,,,false,"5",East
PAGEVMPW,"1371",Page at Vetrans WB - #1371,,"43.016019","-81.15896",,,,,,false,"5",East
RAILKENN,"1445",Railton at Kennedy Place SB - #1445,,"42.994444","-81.152093",,,,,,false,"5",East
RAILPORT,"1446",Railton at Portsmouth SB - #1446,,"42.988241","-81.150232",,,,,,false,"5",East
RAILSADD,"1447",Railton at Saddy SB - #1447,,"42.990818","-81.151272",,,,,,false,"5",East
ROYACAS1,"1609",Royal at Castle EB - #1609,,"42.998691","-81.169127",,,,,,false,"5",East
ROYACAS2,"1610",Royal at Castle WB - #1610,,"42.998722","-81.169297",,,,,,false,"5",East
SANDBEC1,"1618",Sandford at Beckworth NB - #1618,,"43.020779","-81.203558",,,,,,false,"5",East
SANDBEC2,"1619",Sandford at Beckworth SB - #1619,,"43.021116","-81.203822",,,,,,false,"5",East
SANDBENT,"1620",Sandford at Bentley SB - #1620,,"43.026168","-81.2047",,,,,,false,"5",East
SANDHUR1,"1623",Sandford at Huron NB - #1623,,"43.022057","-81.204205",,,,,,false,"5",East
SANDHUR2,"1624",Sandford North of Huron SB - #1624,,"43.023794","-81.205155",,,,,,false,"5",East
SORRHURO,"1663",Sorrel at Huron NB - #1663,,"43.026155","-81.192299",,,,,,false,"5",East
SORRPERT,"1665",Sorrel at Perth Ave NB - #1665,,"43.024095","-81.192746",,,,,,false,"5",East
SOVEBEL1,"1716",Sovereign at Belleisle Crt NB - #1716,,"43.002839","-81.146751",,,,,,false,"5",East
SOVEBEL2,"1717",Sovereign at Belleisle Crt SB - #1717,,"43.002321","-81.146558",,,,,,false,"5",East
SOVENEP2,"1718",Sovereign at Neptune 1 SB - #1718,,"42.99691","-81.14365",,,,,,false,"5",East
SOVENEP4,"1719",Sovereign at  Neptune Cres 2 SB - #1719,,"42.991413","-81.140522",,,,,,false,"5",East
SOVETART,"1720",Sovereign at Tartan SB - #1720,,"42.994375","-81.1422",,,,,,false,"5",East
SOVETRA1,"1721",Sovereign at Trafalgar NB - #1721,,"42.999174","-81.144828",,,,,,false,"5",East
SOVETRA2,"1722",Sovereign at Trafalgar SB - #1722,,"42.998875","-81.144742",,,,,,false,"5",East
THIRCUL1,"1769",Third at Culver Dr NB - #1769,,"43.01032","-81.1892",,,,,,false,"5",East
THIROXF1,"1771",Third at Oxford NB - #1771,,"43.013179","-81.19059",,,,,,false,"5",East
THIROXF2,"1772",Third at Oxford  SB - #1772,,"43.011824","-81.190053",,,,,,false,"5",East
TRAFATK2,"1788",Trafalgar at Atkinson WB - #1788,,"42.990542","-81.1767",,,,,,false,"5",East
TRAFBALF,"1789",Trafalgar at Balfour Place EB - #1789,,"42.989742","-81.179139",,,,,,false,"5",East
TRAFBANC,"1790",Trafalgar at Bancroft  WB - #1790,,"42.994791","-81.1617",,,,,,false,"5",East
TRAFCLA1,"1791",Trafalgar at Clarke Rd EB - #1791,,"42.992012","-81.171074",,,,,,false,"5",East
TRAFCLA2,"1792",Trafalgar at Clarke Rd WB - #1792,,"42.992585","-81.169541",,,,,,false,"5",East
TRAFCLA4,"1793",Trafalgar West of Clarke Rd WB - #1793,,"42.992076","-81.171269",,,,,,false,"5",East
TRAFDAWN,"1794",Trafalgar at Dawn WB - #1794,,"42.989922","-81.178952",,,,,,false,"5",East
TRAFHUD2,"1796",Trafalgar at Hudson  WB - #1796,,"42.99612","-81.157048",,,,,,false,"5",East
TRAFHUD4,"1797",Trafalgar Between Hudson and Admiral WB - #1797,,"42.995507","-81.159215",,,,,,false,"5",East
TRAFMARC,"1798",Trafalgar at Marconi Blvd  WB - #1798,,"42.993244","-81.167201",,,,,,false,"5",East
TRAFSTE1,"1799",Trafalgar at Stevenson Ave EB - #1799,,"42.986995","-81.189037",,,,,,false,"5",East
TRAFSTE2,"1800",Trafalgar at Stevenson Ave WB - #1800,,"42.986732","-81.190088",,,,,,false,"5",East
TRAFTHO1,"1801",Trafalgar at Thorne Ave EB - #1801,,"42.987655","-81.18663",,,,,,false,"5",East
TRAFTHO2,"1802",Trafalgar at Thorne WB - #1802,,"42.987559","-81.18716",,,,,,false,"5",East
TRAFVAN1,"1803",Trafalgar at Vancouver  EB - #1803,,"42.989143","-81.181387",,,,,,false,"5",East
TRAFVAN2,"1804",Trafalgar at Vancouver  WB - #1804,,"42.989093","-81.181802",,,,,,false,"5",East
TWEECOU2,"1810",Tweedsmuir at Court Lane East WB - #1810,,"42.982252","-81.183322",,,,,,false,"5",East
TWEECOU4,"1811",Tweedsmuir at Court Lane West WB - #1811,,"42.982365","-81.185867",,,,,,false,"5",East
TWEEELLE,"1812",Tweedsmuir at Ellesworth WB - #1812,,"42.983016","-81.187912",,,,,,false,"5",East
TWEEHALE,"1813",Tweedsmuir at Hale  WB - #1813,,"42.982862","-81.191508",,,,,,false,"5",East
WAVECAS1,"1896",Wavell at Castle Dr EB - #1896,,"42.999161","-81.170685",,,,,,false,"5",East
WAVECAS2,"1897",Wavell at Castle Dr WB - #1897,,"42.999564","-81.169557",,,,,,false,"5",East
WAVECLA1,"1898",Wavell East of Clarke Rd EB - #1898,,"42.998854","-81.171841",,,,,,false,"5",East
WAVECLA2,"1899",Wavell at Clarke WB - #1899,,"42.998523","-81.173288",,,,,,false,"5",East
WAVEDUN2,"1903",2040 Wavell SB - #1903,,"43.004325","-81.168777",,,,,,false,"5",East
WAVEDUN4,"1905",1990 Wavell SB - #1905,,"43.002382","-81.167767",,,,,,false,"5",East
WAVEDUN6,"1906",Wavell at Dundas SB - #1906,,"43.00596","-81.169634",,,,,,false,"5",East
WAVEEDM1,"1907",Wavell at Edmonton St EB - #1907,,"42.99618","-81.18115",,,,,,false,"5",East
WAVEEDM2,"1908",Wavell at Edmonton St WB - #1908,,"42.996438","-81.180556",,,,,,false,"5",East
WAVEKIW1,"1910",Wavell at Kiwanis Park Dr EB - #1910,,"42.993332","-81.189834",,,,,,false,"5",East
WAVEKIW2,"1911",Wavell at Kiwanis Park Dr WB - #1911,,"42.993712","-81.189514",,,,,,false,"5",East
WAVEMER1,"1912",Wavell East of Merlin Cr EB - #1912,,"42.997589","-81.176181",,,,,,false,"5",East
WAVEMER2,"1913",Wavell at Merlin Cr WB - #1913,,"42.99757","-81.176573",,,,,,false,"5",East
WAVESASK,"1915",Wavell at Saskatoon St WB - #1915,,"42.994743","-81.186617",,,,,,false,"5",East
WAVEVANC,"1916",Wavell at Vancouver St. EB - #1916,,"42.994928","-81.185574",,,,,,false,"5",East
WAVEWIN2,"1918",Wavell at Winnipeg Blvd WB - #1918,,"42.99567","-81.183263",,,,,,false,"5",East
WEXFADMI,"2009",Wexford at Admiral Dr. SB - #2009,,"42.996197","-81.164915",,,,,,false,"5",East
WEXFROY1,"2010",Wexford at Royal Cr NB - #2010,,"42.997986","-81.165923",,,,,,false,"5",East
WEXFROY2,"2011",Wexford at Royal Cr SB - #2011,,"42.997897","-81.165965",,,,,,false,"5",East
YXUTERM,"2179",London Airport - #2179,,"43.027719","-81.148702",,,,,,false,"5",East
BRYDCORN,"2207",Brydges at Cornish EB - #2207,,"42.991416","-81.192435",,,,,,false,"5",East
BRYDGRAY,"2208",Brydges at Graydon WB - #2208,,"42.992032","-81.191809",,,,,,false,"5",East
CLARWHI2,"2212",Clarke at Whitney SB - #2212,,"43.002719","-81.174882",,,,,,false,"5",East
FCBLCHE1,"2228",Fanshawe College Blvd at Cheapside NB - #2228,,"43.016753","-81.201572",,,,,,false,"5",East
FCBLCHE2,"2229",Fanshawe College Blvd at Cheapside SB - #2229,,"43.016776","-81.201699",,,,,,false,"5",East
FCBLFLE1,"2230",Fanshawe College Blvd at Fleming NB - #2230,,"43.015534","-81.198241",,,,,,false,"5",East
FCBLFLE2,"2231",Fanshawe College Blvd at Fleming SB - #2231,,"43.015489","-81.198462",,,,,,false,"5",East
OXFOCLA4,"2257",Oxford east of Clarke WB - #2257,,"43.016714","-81.180353",,,,,,false,"5",East
RAILDAYB,"2267",Railton at Daybreak SB - #2267,,"42.996169","-81.153002",,,,,,false,"5",East
TRAFFAL2,"2279",Trafalgar at Falcon  EB - #2279,,"42.990638","-81.175968",,,,,,false,"5",East
CULVCUL2,"2313",Culver at Culver Court WB - #2313,,"43.009832","-81.184816",,,,,,false,"5",East
DUNDVMP1,"2314",Dundas at VMP EB - #2314,,"43.009974","-81.156251",,,,,,false,"5",East
DUNDVMP2,"2315",Dundas at VMP WB - #2315,,"43.01013","-81.156588",,,,,,false,"5",East
CLARAVA2,"2329",Clarke at Avalon SB - #2329,,"43.006869","-81.176986",,,,,,false,"5",East
CRUMOXFO,"2393",Crumlin at Oxford NB - #2393,,"43.023581","-81.153353",,,,,,false,"5",East
CUDDARTI,"2394",Cuddy at Artisans SB - #2394,,"43.021531","-81.155978",,,,,,false,"5",East
CUDDPAGE,"2395",Cuddy at Page SB - #2395,,"43.018061","-81.154256",,,,,,false,"5",East
OXFOVMPW,"2410",Oxford at Veterans EB - #2410,,"43.022426","-81.159591",,,,,,false,"5",East
PAGECUDD,"2411",Page at Cuddy EB - #2411,,"43.017674","-81.152605",,,,,,false,"5",East
SOVEADM1,"2412",Sovereign at Admiral NB - #2412,,"43.00452","-81.150482",,,,,,false,"5",East
SOVEADM3,"2413",Sovereign North of Admiral SB - #2413,,"43.005617","-81.147772",,,,,,false,"5",East
SOVESOVE,"2414",669 Sovereign NB - #2414,,"43.00778","-81.151293",,,,,,false,"5",East
THIROFO2,"2600",Third South of Oxford SB - #2600,,"43.01016","-81.18933",,,,,,false,"5",East
ADMITRA2,"2635",Admiral at Trafalgar NB - #2635,,"42.994339","-81.165684",,,,,,false,"5",East
CLARBAY2,"2636",Clarke & Bayview NS NB - #2636,,"42.978243","-81.162381",,,,,,false,"5",East
CLARBAY1,"2637",Clarke & Bayview NS SB - #2637,,"42.9787","-81.16278",,,,,,false,"5",East
CLARGOR2,"2638",Clarke & Gore NS SB - #2638,,"42.980898","-81.163876",,,,,,false,"5",East
CLARPEN1,"2639",Clarke & Pension SB - #2639,,"42.97535","-81.161051",,,,,,false,"5",East
CLARPEN2,"2640",Clarke & Pension NB - #2640,,"42.975383","-81.160947",,,,,,false,"5",East
GOREBRA2,"2646",Gore at Braesyde EB - #2646,,"42.978112","-81.172935",,,,,,false,"5",East
GOREFIR2,"2647",Gore at Firestone EB - #2647,,"42.979066","-81.169465",,,,,,false,"5",East
GOREVAL2,"2648",Gore at Montebello EB - #2648,,"42.976956","-81.177237",,,,,,false,"5",East
HALEHAM2,"2650",Hale at Hamilton NB - #2650,,"42.977769","-81.191056",,,,,,false,"5",East
HALEMAG2,"2651",Hale at Magee NB - #2651,,"42.981756","-81.191144",,,,,,false,"5",East
HAMIBRA2,"2652",Hamilton at Braesyde WB - #2652,,"42.974125","-81.171728",,,,,,false,"5",East
HAMICLA1,"2653",Clarke at Hamilton NB - #2653,,"42.970898","-81.158681",,,,,,false,"5",East
HAMICRI1,"2654",Hamilton at Crimson WB - #2654,,"42.971267","-81.163125",,,,,,false,"5",East
HAMICRI2,"2655",Hamilton at Crimson EB - #2655,,"42.971194","-81.163131",,,,,,false,"5",East
HAMIFAI1,"2656",Hamilton at Fairmont WB - #2656,,"42.97713","-81.189507",,,,,,false,"5",East
HAMIGOR1,"2657",Hamilton at Clarke WB - #2657,,"42.97066","-81.159213",,,,,,false,"5",East
HAMIOAKL,"2658",Hamilton west of Braeside WB - #2658,,"42.974825","-81.174103",,,,,,false,"5",East
HAMIRIV2,"2659",Hamilton at River Run WB - #2659,,"42.972893","-81.167624",,,,,,false,"5",East
HAMIVALL,"2660",Hamilton at Gore WB - #2660,,"42.975412","-81.177125",,,,,,false,"5",East
HAMIWAT2,"2661",Hamilton at Watmar WB - #2661,,"42.976184","-81.182626",,,,,,false,"5",East
HAMIYMCA,"2662",Hamilton east of Meadowlily WB - #2662,,"42.976602","-81.185674",,,,,,false,"5",East
MANITWE2,"2665",Manitoulin at Tweedsmuir SB - #2665,,"42.982431","-81.181183",,,,,,false,"5",East
MARCEXMO,"2666",Marconi at Exmouth WB - #2666,,"42.98719","-81.156276",,,,,,false,"5",East
MARCJULI,"2667",Marconi at Julia NB - #2667,,"42.987999","-81.163007",,,,,,false,"5",East
MARCNOE2,"2668",Marconi at Noel NB - #2668,,"42.989722","-81.164239",,,,,,false,"5",East
MARCTRA2,"2670",Marconi at Trafalgar NB - #2670,,"42.99274","-81.167273",,,,,,false,"5",East
MARCWOOD,"2671",Marconi at Woodview WB - #2671,,"42.986551","-81.160893",,,,,,false,"5",East
MONTELD2,"2672",Montabello at Eldorado SB - #2672,,"42.977398","-81.178169",,,,,,false,"5",East
MONTTWE2,"2673",Montabello at Tweedsmuir SB - #2673,,"42.980081","-81.17982",,,,,,false,"5",East
TWEEBER2,"2674",Tweedsmuir & Court Lane W Leg EB - #2674,,"42.982168","-81.185297",,,,,,false,"5",East
TWEEFAI2,"2675",Tweedsmuir at Fairway EB - #2675,,"42.982974","-81.190822",,,,,,false,"5",East
TWEEMAN2,"2676",Tweedsmuir & Manitoulin EB - #2676,,"42.982669","-81.187178",,,,,,false,"5",East
WEXFADM2,"2677",Wexford & Admiral NB - #2677,,"42.996373","-81.164955",,,,,,false,"5",East
OXFOVMP1,"2745",Oxford at Veteran's Memorial Parkway WB - #2745,,"43.0228","-81.15906",,,,,,false,"5",East
FANSCOLL,"2914",Fanshawe College - #2914,,"43.01173","-81.19887",,,,,,false,"5",East
1030CLAR,"2929",1030 Clarke Road NB - #2929,,"43.02479","-81.18573",,,,,,false,"5",East
15701ROB,"2930",15701 Robins Hill WB - #2930,,"43.02812","-81.16494",,,,,,false,"5",East
15835ROB,"2931",15835 Robins Hill WB - #2931,,"43.03034","-81.1688",,,,,,false,"5",East
1901CRUM,"2932",1901 Crumlin SB - #2932,,"43.02708","-81.15523",,,,,,false,"5",East
1980CRUM,"2933",1980 Crumlin NB - #2933,,"43.02713","-81.15513",,,,,,false,"5",East
CLARCHE,"2934",Clarke at Cheapside NB - #2934,,"43.02131","-81.18399",,,,,,false,"5",East
CLARKOXF,"2935",Clarke at Oxford NB - #2935,,"43.01786","-81.18229",,,,,,false,"5",East
CLARSTR,"2936",Clarke at Stronach Crescent SB - #2936,,"43.02662","-81.18683",,,,,,false,"5",East
HUROCLA1,"2937",Huron at Clarke EB - #2937,,"43.02813","-81.1867",,,,,,false,"5",East
HUROCLA2,"2938",Huron at Clarke WB - #2938,,"43.0286","-81.18543",,,,,,false,"5",East
HUROVET,"2939",Huron at Veterans EB - #2939 ,,"43.03049","-81.17827",,,,,,false,"5",East
HUROVET1,"2940",Huron at Veterans WB - #2940,,"43.0304","-81.17911",,,,,,false,"5",East
ROBHILEB,"2941",15700 Robins Hill Road EB - #2941,,"43.02797","-81.16479",,,,,,false,"5",East
ROBHILSB,"2942",15902 Robins Hill Road SB - #2942,,"43.03012","-81.16886",,,,,,false,"5",East
ROBHURO,"2943",Robins Hill at Huron SB - #2943,,"43.0324","-81.17",,,,,,false,"5",East
ROBICRU1,"2944",Robins Hill at Crumlin WB - #2944,,"43.02978","-81.15746",,,,,,false,"5",East
ROBICRUM,"2945",Robins Hill at Crumlin EB - #2945,,"43.0298","-81.15699",,,,,,false,"5",East
ROBIHUR1,"2946",Robins Hill South of Huron NB - #2946,,"43.03201","-81.16962",,,,,,false,"5",East
CLARCHE3,"2947",Clarke at Cheapside SB - #2947 ,,"43.02229","-81.1847",,,,,,false,"5",East
CLAROXF4,"2948",Clarke at Oxford SB - #2948 ,,"43.01722","-81.18218",,,,,,false,"5",East
HAMWILD1,"2957",Hamilton at Wildgoose WB - #2957 ,,"42.970441","-81.155181",,,,,,false,"5",East
HAMWILD2,"2958",Hamilton at Wildgoose EB - #2958 ,,"42.970243","-81.154678",,,,,,false,"5",East
ANDOCOM1,"154",Andover at Commissioners NB - #154,,"42.955725","-81.275336",,,,,,false,"6",West
ANDOCOM2,"155",Andover at Commissioners SB - #155,,"42.955721","-81.275497",,,,,,false,"6",West
ANDOELMG,"156",Andover at Elmgrove Cr SB - #156,,"42.951688","-81.275511",,,,,,false,"6",West
ANDONOVE,"158",Andover at Novello NB - #158,,"42.952839","-81.275472",,,,,,false,"6",West
ANDOVIG1,"160",Andover at Village Green NB - #160,,"42.953684","-81.275744",,,,,,false,"6",West
ANDOVIG2,"161",Andover at Village Green SB - #161,,"42.95356","-81.275802",,,,,,false,"6",West
ANDOVIS2,"163",Andover at Viscount SB - #163,,"42.948172","-81.275288",,,,,,false,"6",West
ANDOVIS3,"164",Andover north of Viscount  NB - #164,,"42.948217","-81.275205",,,,,,false,"6",West
BASEMGR1,"196",Base Line at McGregor EB - #196,,"42.959013","-81.264059",,,,,,false,"6",West
BASEWES1,"211",Base Line east of West St  EB - #211,,"42.958703","-81.267666",,,,,,false,"6",West
BASEWES2,"212",30 Base Line WB - #212,,"42.959042","-81.264016",,,,,,false,"6",West
BASEWES3,"213",Base Line west of West St  EB - #213,,"42.958329","-81.271553",,,,,,false,"6",West
BASEWES4,"214",90 Base Line WB - #214,,"42.958764","-81.267069",,,,,,false,"6",West
BASEWHA2,"216",Base Line at Wharncliffe WB - #216,,"42.959398","-81.260128",,,,,,false,"6",West
BEACBAS1,"222",Beachwood at Base Line NB - #222,,"42.957793","-81.275356",,,,,,false,"6",West
BEACBAS2,"223",Beachwood at Base Line SB - #223,,"42.957706","-81.275411",,,,,,false,"6",West
BELMHILL,"234",Belmont at Hillsborough EB - #234,,"42.947155","-81.261834",,,,,,false,"6",West
BELMNODA,"235",Belmont at Notre Dame EB - #235,,"42.946298","-81.26779",,,,,,false,"6",West
BELMSLAW,"236",Belmont at St Lawrence EB - #236,,"42.946828","-81.264574",,,,,,false,"6",West
BELMWHAR,"237",Belmont at Wharncliffe EB - #237,,"42.947323","-81.259069",,,,,,false,"6",West
BERKGAR1,"240",Berkshire at Gardenwood NB - #240,,"42.962686","-81.285332",,,,,,false,"6",West
BERKGAR4,"241",Berkshire north of Gardenwood SB - #241,,"42.962481","-81.286307",,,,,,false,"6",West
BERKROB1,"242",Berkshire at Robin NB - #242,,"42.960797","-81.282859",,,,,,false,"6",West
BERKROB2,"243",Berkshire at Robin SB - #243,,"42.961183","-81.283003",,,,,,false,"6",West
BERKSPR1,"244",Berkshire at Springbank NB - #244,,"42.964044","-81.290657",,,,,,false,"6",West
BERKSPR2,"245",Berkshire at Springbank SB - #245,,"42.963902","-81.290635",,,,,,false,"6",West
BERKTOP1,"246",Berkshire at Topping Lane NB - #246,,"42.959633","-81.283813",,,,,,false,"6",West
BERKTOP2,"247",Berkshire at Topping Lane SB - #247,,"42.959659","-81.283837",,,,,,false,"6",West
BOLEBASE,"275",Boler at Byron Baseline NB - #275,,"42.953654","-81.331251",,,,,,false,"6",West
BOLECOM1,"276",Boler south of Commissioners NB - #276,,"42.958331","-81.332375",,,,,,false,"6",West
BOLECOM3,"277",Boler north of Commissioners NB - #277,,"42.960072","-81.332683",,,,,,false,"6",West
BOLEGLEN,"278",Boler at Glenrose NB - #278,,"42.956735","-81.332025",,,,,,false,"6",West
BOLEGRIF,"279",Boler at Griffith NB - #279,,"42.945802","-81.329332",,,,,,false,"6",West
BOLEWAYN,"280",Boler at Wayne Road NB - #280,,"42.949368","-81.330188",,,,,,false,"6",West
BYBABELV,"314",Byron Baseline at Belvedere EB - #314,,"42.952538","-81.33747",,,,,,false,"6",West
BYBABYRO,"316",Byron Baseline at Byron Blvd EB - #316,,"42.952929","-81.333022",,,,,,false,"6",West
BYBAGRIF,"318",Byron Baseline at Griffith EB - #318,,"42.952315","-81.339778",,,,,,false,"6",West
COMMBOL2,"448",Commissioners at Boler WB - #448,,"42.959479","-81.331786",,,,,,false,"6",West
COMMGRD1,"456",Commissioners at Gordon EB - #456,,"42.956583","-81.264504",,,,,,false,"6",West
COMMGRD2,"457",Commissioners at Gordon WB - #457,,"42.956814","-81.263811",,,,,,false,"6",West
COMMHAM2,"458",Commissioners east of Halls Mills WB - #458,,"42.960372","-81.334565",,,,,,false,"6",West
COMMHUXL,"461",Commissioners at Huxley WB - #461,,"42.95665","-81.267432",,,,,,false,"6",West
COMMLYN4,"468",Opposite St George's Parish - #468,,"42.958091","-81.326569",,,,,,false,"6",West
COMMNASH,"470",Commissioners at Nashua EB - #470,,"42.95727","-81.324072",,,,,,false,"6",West
COMMNOR1,"471",Commissioners at North EB - #471,,"42.956376","-81.321049",,,,,,false,"6",West
COMMNOR2,"472",Commissioners at North WB - #472,,"42.95665","-81.32147",,,,,,false,"6",West
COMMNOT1,"473",Commissioners west of Nottinghill EB - #473,,"42.952527","-81.299502",,,,,,false,"6",West
COMMNOT3,"474",Commissioners east of Nottinghill EB - #474,,"42.95305","-81.296777",,,,,,false,"6",West
COMMSPR1,"479",Commissioners at Springbank Park EB - #479,,"42.958444","-81.328319",,,,,,false,"6",West
COMMSPR2,"480",Commissioners & Springbank Dr WB - #480,,"42.955838","-81.318653",,,,,,false,"6",West
COMMSPR4,"481",Commissioners at Springbank Park WB - #481,,"42.958611","-81.328577",,,,,,false,"6",West
COMMSTEP,"482",Commissioners at Stephen WB - #482,,"42.962034","-81.339632",,,,,,false,"6",West
COMMVISC,"483",Commissioners at Viscount EB - #483,,"42.95637","-81.26871",,,,,,false,"6",West
CRANCOMM,"487",Cranbrook at Commissioners NB - #487,,"42.951921","-81.302897",,,,,,false,"6",West
CRANHIMO,"488",Cranbrook at Hillsmount NB - #488,,"42.947556","-81.303783",,,,,,false,"6",West
EMERHIW1,"644",Emery at Highwood EB - #644,,"42.963584","-81.270317",,,,,,false,"6",West
EMERHIW2,"645",Emery at Highwood WB - #645,,"42.963681","-81.270068",,,,,,false,"6",West
EMERPADD,"646",Emery at Paddington EB - #646,,"42.963561","-81.263574",,,,,,false,"6",West
EMERPHY1,"647",Emery at Phyllis EB - #647,,"42.963473","-81.273514",,,,,,false,"6",West
EMERPHY2,"648",Emery at Phyllis WB - #648,,"42.963571","-81.272846",,,,,,false,"6",West
EMERWIN1,"649",Emery west of Winston EB - #649,,"42.963719","-81.266921",,,,,,false,"6",West
EMERWIN2,"650",Emery at Winston WB - #650,,"42.963768","-81.26765",,,,,,false,"6",West
GARDBER1,"759",Gardenwood at Berkshire NB - #759,,"42.962908","-81.284862",,,,,,false,"6",West
GARDRID1,"762",Gardenwood at Ridgewood EB - #762,,"42.966547","-81.283639",,,,,,false,"6",West
GARDRID2,"763",Gardenwood east of Ridgewood WB - #763,,"42.967144","-81.282587",,,,,,false,"6",West
GARDSOU2,"766",Gardenwood at Southcrest SB - #766,,"42.964872","-81.285158",,,,,,false,"6",West
GARDSOU3,"767",57 Gardenwood NB - #767,,"42.964982","-81.285133",,,,,,false,"6",West
GRIFBBA2,"808",Griffith at Byron Baseline SB - #808,,"42.951835","-81.340118",,,,,,false,"6",West
GRIFBOLE,"810",Griffith at Boler EB - #810,,"42.944079","-81.329386",,,,,,false,"6",West
GRIFCOMM,"811",Griffith at Commissioners SB - #811,,"42.962581","-81.342749",,,,,,false,"6",West
GRIFDEA2,"812",Boler Mountain SB - #812,,"42.946162","-81.33628",,,,,,false,"6",West
GRIFFAIR,"814",Griffith at Fairlane SB - #814,,"42.949289","-81.338973",,,,,,false,"6",West
GRIFHEMO,"816",Griffith at Helena Montague SB - #816,,"42.959851","-81.34213",,,,,,false,"6",West
GRIFNORM,"817",Griffith at Norman SB - #817,,"42.956299","-81.34119",,,,,,false,"6",West
GRIFROBW,"818",Griffith at Robinwood EB - #818,,"42.942271","-81.333418",,,,,,false,"6",West
GRIFWIDD,"822",Griffith at Widdicomb SB - #822,,"42.944539","-81.33588",,,,,,false,"6",West
HALLCOMM,"843",Halls Mills at Commissioners SB - #843,,"42.960701","-81.334838",,,,,,false,"6",West
HIGVWHA1,"949",Highview at Wharncliffe EB - #949,,"42.953793","-81.259268",,,,,,false,"6",West
HIGVWHA4,"951",Highview at Wharncliffe WB - #951,,"42.953883","-81.258879",,,,,,false,"6",West
HORTWHA2,"980",Horton west of Wharncliffe WB - #980,,"42.976819","-81.263014",,,,,,false,"6",West
HORTWHA3,"981",Horton west of Wharncliffe EB - #981,,"42.976569","-81.264939",,,,,,false,"6",West
HORTWHA4,"982",Horton west of Wharncliffe 2 WB - #982,,"42.97667","-81.265273",,,,,,false,"6",West
LANGHOLB,"1105",Langarth at Holborn WB - #1105,,"42.96491","-81.2622",,,,,,false,"6",West
MACKEMER,"1131",MacKay at Emery SB - #1131,,"42.963916","-81.264329",,,,,,false,"6",West
MCMAWON2,"1154",McMaster at Wonderland WB - #1154,,"42.942934","-81.287573",,,,,,false,"6",West
NOTRVISC,"1240",Notre Dame at Viscount SB - #1240,,"42.94825","-81.270439",,,,,,false,"6",West
SOUTBEA1,"1670",Southcrest at Beachwood EB - #1670,,"42.964424","-81.276425",,,,,,false,"6",West
SPRIBER1,"1728",Springbank at Berkshire Dr FS 1 EB - #1728,,"42.964565","-81.290752",,,,,,false,"6",West
SPRIBER3,"1729",492 Springbank EB - #1729,,"42.966105","-81.28766",,,,,,false,"6",West
SPRIBER4,"1730",Springbank at Berkshire WB - #1730,,"42.964413","-81.291526",,,,,,false,"6",West
SPRICHEL,"1732",Springbank at Chelsea WB - #1732,,"42.971031","-81.27803",,,,,,false,"6",West
SPRICOM1,"1733",Springbank at Commissioners W EB - #1733,,"42.954695","-81.3155",,,,,,false,"6",West
SPRICOM2,"1734",Springbank at Commissioners WB - #1734,,"42.954791","-81.315584",,,,,,false,"6",West
SPRIGRE1,"1735",Springbank at Greenside EB - #1735,,"42.973233","-81.273206",,,,,,false,"6",West
SPRIGRE2,"1736",Springbank at Greenside WB - #1736,,"42.97379","-81.272368",,,,,,false,"6",West
SPRIGROW,"1737",Springbank at Greenwood EB - #1737,,"42.971006","-81.277714",,,,,,false,"6",West
SPRIHIC1,"1738",Springbank at Hillcrest Dr EB - #1738,,"42.958905","-81.303107",,,,,,false,"6",West
SPRIHIC2,"1739",Springbank at Hillcrest Dr WB - #1739,,"42.959062","-81.302965",,,,,,false,"6",West
SPRIJAR1,"1740",Springbank at Jarvis St EB - #1740,,"42.960397","-81.299607",,,,,,false,"6",West
SPRIJAR2,"1741",Springbank at Jarvis St WB - #1741,,"42.960018","-81.300721",,,,,,false,"6",West
SPRIKER1,"1742",Springbank at Kernohan Parkway EB - #1742,,"42.969358","-81.281031",,,,,,false,"6",West
SPRIKER2,"1743",Springbank at Kernohan Pkwy WB - #1743,,"42.969429","-81.281274",,,,,,false,"6",West
SPRIMAR1,"1744",Springbank at Mary Ave EB - #1744,,"42.967616","-81.284642",,,,,,false,"6",West
SPRIMAR2,"1745",Springbank at Mary Ave WB - #1745,,"42.968086","-81.283962",,,,,,false,"6",West
SPRIQUI1,"1746",Springbank at Quinella EB - #1746,,"42.961586","-81.2971",,,,,,false,"6",West
SPRIQUI2,"1747",Springbank at Quinella WB - #1747,,"42.961707","-81.297108",,,,,,false,"6",West
SPRISPRI,"1748",Springbank at Springbank EB - #1748,,"42.975016","-81.270079",,,,,,false,"6",West
SPRITROW,"1749",Springbank at Trowbridge WB - #1749,,"42.967187","-81.285715",,,,,,false,"6",West
SPRIWES1,"1750",928 Springbank EB - #1750,,"42.956079","-81.312829",,,,,,false,"6",West
SPRIWES3,"1752",Springbank at Westmount EB - #1752,,"42.956933","-81.3085",,,,,,false,"6",West
SPRIWES4,"1753",Springbank West of Westmount WB - #1753,,"42.956117","-81.312954",,,,,,false,"6",West
SPRIWON1,"1754",Springbank at Wonderland  EB - #1754,,"42.96374","-81.292535",,,,,,false,"6",West
SPRIWON2,"1755",Springbank at Wonderland  WB - #1755,,"42.96345","-81.293513",,,,,,false,"6",West
