stop_id,stop_code,stop_name,stop_desc,stop_lat,stop_lon,zone_id,stop_url,location_type,parent_station,stop_timezone,wheelchair_boarding,id,Name
STANWHAR,"1759",Stanley at Wharncliffe EB - #1759,,"42.977719","-81.261462",,,,,,false,"6",West
VISCCOM2,"1872",Viscount AT Commissioners SB - #1872,,"42.955816","-81.269168",,,,,,false,"6",West
VISCCRAN,"1873",Viscount at Cranbrook WB - #1873,,"42.944409","-81.302864",,,,,,false,"6",West
VISCFARN,"1874",Viscount at Farnham Rd WB - #1874,,"42.945708","-81.295842",,,,,,false,"6",West
VISCFOXM,"1875",Viscount at Foxmill Cr WB - #1875,,"42.947583","-81.284005",,,,,,false,"6",West
VISCGAL1,"1876",Viscount at Galloway Cr FS NB - #1876,,"42.95146","-81.268015",,,,,,false,"6",West
VISCGAL2,"1877",Viscount South of Galloway Cr SB - #1877,,"42.950234","-81.268816",,,,,,false,"6",West
VISCGAL3,"1878",Viscount at Galloway Cr NS NB - #1878,,"42.949847","-81.269034",,,,,,false,"6",West
VISCGARD,"1879",Viscount at Gardenvale WB - #1879,,"42.947631","-81.280906",,,,,,false,"6",West
VISCPIVA,"1883",Viscount at Pine Valley Dr EB - #1883,,"42.947553","-81.280877",,,,,,false,"6",West
VISCSTEE,"1884",Viscount at Steeplechase EB - #1884,,"42.947528","-81.283968",,,,,,false,"6",West
VISCTAV1,"1885",Viscount at Tavistock Rd NB - #1885,,"42.953716","-81.268278",,,,,,false,"6",West
VISCTAV2,"1886",Viscount at Tavistock Rd 1 SB - #1886,,"42.95324","-81.268281",,,,,,false,"6",West
VISCVIGR,"1888",Viscount at Village Green WB - #1888,,"42.944876","-81.299283",,,,,,false,"6",West
VISCWON1,"1889",Saunders Secondary School EB - #1889,,"42.946666","-81.291751",,,,,,false,"6",West
VISCWON2,"1890",Viscount East of Wonderland WB - #1890,,"42.947195","-81.288537",,,,,,false,"6",West
VISCWON3,"1891",Viscount East of Wonderland EB - #1891,,"42.947173","-81.288021",,,,,,false,"6",West
VISCWON5,"1893",Viscount West of Wonderland EB - #1893,,"42.946911","-81.289895",,,,,,false,"6",West
WESTMAL1,"1997",Westmount Mall at Stop 1 - #1997,,"42.947415","-81.29255",,,,,,false,"6",West
WESTMAL2,"1998",Westmount Mall at Stop 2 - #1998,,"42.947407","-81.292334",,,,,,false,"6",West
WESTMAL3,"1999",Westmount Mall at Stop 3 - #1999,,"42.947484","-81.292059",,,,,,false,"6",West
WHARBAS1,"2015",Wharncliffe & Base Line FS NB - #2015,,"42.959796","-81.261022",,,,,,false,"6",West
WHARBAS2,"2016",Wharncliffe at BaseLine NS SB - #2016,,"42.959545","-81.261148",,,,,,false,"6",West
WHARBYR1,"2022",Wharncliffe at Byron NB - #2022,,"42.973704","-81.262004",,,,,,false,"6",West
WHARBYR2,"2023",Wharncliffe at Byron  SB - #2023,,"42.974058","-81.262197",,,,,,false,"6",West
WHARCENT,"2024",Wharncliffe at Center SB - #2024,,"42.961302","-81.261271",,,,,,false,"6",West
WHARCOM1,"2026",Wharncliffe at Commissioners NB - #2026,,"42.957951","-81.260699",,,,,,false,"6",West
WHARCOM2,"2027",Wharncliffe at Commissioners SB - #2027,,"42.957599","-81.260802",,,,,,false,"6",West
WHARDEVO,"2029",Wharncliffe at Devonshire  NB - #2029,,"42.962375","-81.2612",,,,,,false,"6",West
WHARELM1,"2031",Wharncliffe at Elmwood NB - #2031,,"42.969997","-81.261765",,,,,,false,"6",West
WHARELM2,"2032",Wharncliffe at Elmwood SB - #2032,,"42.970327","-81.261912",,,,,,false,"6",West
WHAREME1,"2033",Wharncliffe at Emery NB - #2033,,"42.964157","-81.261322",,,,,,false,"6",West
WHAREME2,"2034",Wharncliffe at Emery SB - #2034,,"42.963383","-81.261459",,,,,,false,"6",West
WHAREUCL,"2037",Wharncliffe at Euclid NB - #2037,,"42.97506","-81.262093",,,,,,false,"6",West
WHARRIG1,"2050",Wharncliffe at The Ridgeway NB - #2050,,"42.979274","-81.262382",,,,,,false,"6",West
WHARRIG2,"2051",Wharncliffe at The Ridgeway SB - #2051,,"42.979557","-81.262542",,,,,,false,"6",West
WHARTEC1,"2054",Wharncliffe at Tecumseh NB - #2054,,"42.967274","-81.261544",,,,,,false,"6",West
WHARTEC2,"2055",Wharncliffe at Tecumseh SB - #2055,,"42.967059","-81.261704",,,,,,false,"6",West
WHARWDAL,"2056",Wharncliffe at Westdale SB - #2056,,"42.944526","-81.257707",,,,,,false,"6",West
WONDCOM1,"2100",Wonderland South of Commissioners NB - #2100,,"42.95344","-81.290359",,,,,,false,"6",West
WONDCOM2,"2101",Wonderland at Commissioners SB - #2101,,"42.953736","-81.290681",,,,,,false,"6",West
WONDCOM3,"2102",Wonderland North of Commissioners NB - #2102,,"42.955837","-81.290977",,,,,,false,"6",West
WONDMMA1,"2111",Wonderland North of McMaster NB - #2111,,"42.943955","-81.287721",,,,,,false,"6",West
WONDMMA2,"2112",Wonderland South of McMaster SB - #2112,,"42.942987","-81.2865",,,,,,false,"6",West
WONDMMA3,"2113",Wonderland South of McMaster NB - #2113,,"42.942913","-81.285326",,,,,,false,"6",West
WONDMMA4,"2114",Wonderland North of McMaster SB - #2114,,"42.944487","-81.288397",,,,,,false,"6",West
WONDPVA1,"2119",Wonderland at PineValley Gate NB - #2119,,"42.942462","-81.283426",,,,,,false,"6",West
WONDPVA2,"2120",Wonderland at Pine Valley Blvd SB - #2120,,"42.942327","-81.283654",,,,,,false,"6",West
WONDPVA4,"2121",Wonderland at  PineValley Lane SB - #2121,,"42.941199","-81.28219",,,,,,false,"6",West
WONDROSE,"2124",Wonderland at Rosecliffe Terr. SB - #2124,,"42.959528","-81.293657",,,,,,false,"6",West
WONDSDA1,"2128",Wonderland at Southdale NB - #2128,,"42.939594","-81.281397",,,,,,false,"6",West
WONDSPR1,"2132",Wonderland at Springbank NB - #2132,,"42.964403","-81.293102",,,,,,false,"6",West
WONDTEE1,"2134",Wonderland at Teeple Terrace NB - #2134,,"42.959046","-81.293315",,,,,,false,"6",West
WONDVIL1,"2135",Wonderland at Village Green NB - #2135,,"42.95074","-81.289716",,,,,,false,"6",West
WONDVIL2,"2136",Wonderland at Village Green Ave SB - #2136,,"42.951463","-81.290115",,,,,,false,"6",West
WONDVIS2,"2138",Wonderland at Viscount NS1 SB - #2138,,"42.948855","-81.289568",,,,,,false,"6",West
WONDVIS3,"2139",780 Wonderland Rd NB - #2139,,"42.948946","-81.289303",,,,,,false,"6",West
BASEWHA1,"2194",Base Line at Wharncliffe EB - #2194,,"42.959332","-81.259828",,,,,,false,"6",West
BERKBER1,"2195",Berkshire at Berkshire Place NB - #2195,,"42.962777","-81.288488",,,,,,false,"6",West
BERKBER2,"2196",Berkshire at Berkshire Place SB - #2196,,"42.962676","-81.288377",,,,,,false,"6",West
BERKGAR2,"2198",Berkshire south of Gardenwood SB - #2198,,"42.962572","-81.28437",,,,,,false,"6",West
COMMBOL1,"2213",Commissioners at Boler EB - #2213,,"42.959432","-81.332109",,,,,,false,"6",West
EMERRIDG,"2220",Emery at Ridgewood WB - #2220,,"42.964458","-81.275884",,,,,,false,"6",West
RIDGKER2,"2272",Ridgewood at Kernohan WB - #2272,,"42.967875","-81.280991",,,,,,false,"6",West
WHARHORT,"2293",Wharncliffe at Horton SB - #2293,,"42.975906","-81.262288",,,,,,false,"6",West
WONDVIS4,"2305",Wonderland at Viscount Rd SB - #2305,,"42.947805","-81.28928",,,,,,false,"6",West
COMMWHAR,"2312",COMMISSIONERS & WHARNCLIF - #2312,,"42.956949","-81.260082",,,,,,false,"6",West
WONDSPRI,"2323",Wonderland at Springbank SB - #2323,,"42.963094","-81.293081",,,,,,false,"6",West
WESTMAL4,"2436",Westmount Mall at Stop 4 - #2436,,"42.947502","-81.291672",,,,,,false,"6",West
WESTMAL5,"2437",Westmount Mall at Stop 5 - #2437,,"42.9473","-81.292217",,,,,,false,"6",West
WESTMAL6,"2438",Westmount Mall at Stop 6 - #2438,,"42.947352","-81.291827",,,,,,false,"6",West
COMMBEA1,"2461",Commissioners at Beachwood WB - #2461,,"42.956137","-81.276837",,,,,,false,"6",West
COMMBEA2,"2462",Commissioners west of Beachwood EB - #2462,,"42.955804","-81.278701",,,,,,false,"6",West
COMMBEA3,"2463",353 Commissioners - #2463,,"42.955854","-81.279878",,,,,,false,"6",West
COMMFOE1,"2464",Commissioners at Forest Edge WB - #2464,,"42.954813","-81.287851",,,,,,false,"6",West
COMMFOE2,"2465",Commissioners at Forest Edge EB - #2465,,"42.954529","-81.288286",,,,,,false,"6",West
COMMTOP1,"2466",Commissioners at Topping Lane WB - #2466,,"42.955326","-81.284038",,,,,,false,"6",West
COMMTOP2,"2467",Commissioners at Topping Lane EB - #2467,,"42.955275","-81.283406",,,,,,false,"6",West
COMMCAD1,"2531",Commissioners at Cadeau Terrace 1 WB - #2531,,"42.963896","-81.347073",,,,,,false,"6",West
COMMCAD2,"2532",Commissioners at Cadeau Terrace 2 WB - #2532,,"42.965448","-81.350985",,,,,,false,"6",West
COMMCHE1,"2533",Commissioners at Chestnut Hill 1 SB - #2533,,"42.965489","-81.351525",,,,,,false,"6",West
COMMCHE2,"2534",Commissioners at Chestnut Hill 2 SB - #2534,,"42.963767","-81.347056",,,,,,false,"6",West
COMMGRA2,"2535",Commissioners at Grandview EB - #2535,,"42.963298","-81.344232",,,,,,false,"6",West
COMMGRAN,"2536",Commissioners at Grandview WB - #2536,,"42.963281","-81.3438",,,,,,false,"6",West
COMMHAL2,"2537",Commissioners at Halls Mills EB - #2537,,"42.960233","-81.334417",,,,,,false,"6",West
COMMREYN,"2538",Commissioners at Reynolds SB - #2538,,"42.962395","-81.341114",,,,,,false,"6",West
COMMSTE1,"2539",Commissioners at Stephen SB - #2539,,"42.961279","-81.33756",,,,,,false,"6",West
KAINKIRK,"2542",Kains at Kirkpatrick NB - #2542,,"42.9724","-81.35654",,,,,,false,"6",West
KAINOXFN,"2543",Kains at Oxford NB - #2543,,"42.968622","-81.35529",,,,,,false,"6",West
KAINRIVE,"2545",Kains at Riverbend WB - #2545,,"42.974116","-81.36311",,,,,,false,"6",West
KAINSUMM,"2546",Kains at Summerville NB - #2546,,"42.973192","-81.357717",,,,,,false,"6",West
RIVESHOR,"2547",Riverbend at Shore SB - #2547,,"42.96848","-81.36103",,,,,,false,"6",West
NOTRBELM,"2589",Notre Dame at Belmont NB - #2589,,"42.945862","-81.26784",,,,,,false,"6",West
NOTRNORT,"2590",Notre Dame at Norton NB - #2590,,"42.942767","-81.266955",,,,,,false,"6",West
NOTRSDAL,"2591",Notre Dame at Southdale NB - #2591,,"42.940578","-81.266504",,,,,,false,"6",West
NOTRVIS2,"2592",Notre Dame at Viscount NB - #2592,,"42.948463","-81.270496",,,,,,false,"6",West
WHARSOUT,"2594",Wharncliffe & Southdale NS SB - #2594,,"42.941215","-81.257979",,,,,,false,"6",West
BASECOTS,"2605",Base Line at Cotswold WB - #2605,,"42.958416","-81.27099",,,,,,false,"6",West
CRANBAR2,"2620",Cranbrook at Barclay SB - #2620,,"42.940934","-81.303746",,,,,,false,"6",West
CRANBAR3,"2621",Cranbrook at Barclay NB - #2621,,"42.940907","-81.303501",,,,,,false,"6",West
CRANBIRC,"2622",Cranbrook at Birchmount WB - #2622,,"42.938746","-81.305251",,,,,,false,"6",West
CRANROBE,"2623",Cranbrook at Roberston Place EB - #2623,,"42.93861","-81.306893",,,,,,false,"6",West
CRANSCHR,"2624",Cranbrook at Schraeder WB - #2624,,"42.938708","-81.307824",,,,,,false,"6",West
CRANVIS2,"2625",Cranbrook & Viscount NB - #2625,,"42.944139","-81.302879",,,,,,false,"6",West
TILLSOU2,"2631",Tillman at Southdale NB - #2631,,"42.937564","-81.308705",,,,,,false,"6",West
VISCDUN2,"2633",Viscount at Dunsmoor EB - #2633,,"42.944816","-81.298567",,,,,,false,"6",West
HORTSPRI,"2683",Horton at Springbank WB - #2683,,"42.975348","-81.269979",,,,,,false,"6",West
SPRIFORH,"2688",Springbank at Forest Hill WB - #2688,,"42.972636","-81.274765",,,,,,false,"6",West
COMMAND1,"2758",Commissioners at Andover EB - #2758,,"42.956092","-81.274636",,,,,,false,"6",West
COMMWES1,"2759",Commissioners at West WB - #2759,,"42.956494","-81.270401",,,,,,false,"6",West
DALHBRI2,"2760",Dalhousie at Brixham WB - #2760,,"42.938928","-81.291187",,,,,,false,"6",West
DALHMCM1,"2761",Dalhousie south of McMaster SB - #2761,,"42.940333","-81.28826",,,,,,false,"6",West
KERNRID1,"2762",Kernohan at Ridgewood Cres NB - #2762,,"42.968108","-81.280591",,,,,,false,"6",West
KERNSPR1,"2763",Kernohan at Springbank Dr SB - #2763,,"42.968954","-81.281168",,,,,,false,"6",West
SOUTBAS1,"2764",Southcrest at Base Line Rd WB - #2764,,"42.963995","-81.280197",,,,,,false,"6",West
SOUTBAS2,"2765",Southcrest at Base Line EB - #2765,,"42.963954","-81.279755",,,,,,false,"6",West
SOUTGAR1,"2766",Southcrest at Gardenwood Dr WB - #2766,,"42.963886","-81.284769",,,,,,false,"6",West
SOUTGAR2,"2767",Southcrest east of Gardenwood EB - #2767,,"42.96383","-81.28437",,,,,,false,"6",West
TOPPCOM1,"2770",Topping Lane at Commissioners NB - #2770,,"42.955886","-81.283106",,,,,,false,"6",West
COMMWHA1,"2813",Commissioners at Wharncliffe FS EB - #2813,,"42.956738","-81.259968",,,,,,false,"6",West
COMMWHA2,"2814",Commissioners at Wharncliffe WB - #2814,,"42.9569","-81.26194",,,,,,false,"6",West
OXFORIV1,"2974",Oxford east of Riverbend EB - #2974,,"42.96587","-81.35806",,,,,,false,"6",West
RIVEOXF1,"2975",Riverbend at Oxford SB - #2975,,"42.96575","-81.36141",,,,,,false,"6",West
ADELADA1,"20",Adelaide at Ada NB - #20,,"42.974289","-81.225234",,,,,,false,"7",Inner_City_South
ADELADA2,"21",Adelaide at Ada SB - #21,,"42.97461","-81.225615",,,,,,false,"7",Inner_City_South
ADELEDNA,"29",Adelaide at Edna SB - #29,,"42.971883","-81.224342",,,,,,false,"7",Inner_City_South
ADELLEA1,"48",Adelaide south of Leathorne St NB - #48,,"42.960884","-81.216852",,,,,,false,"7",Inner_City_South
ADELLEA2,"49",Adelaide at Leathorne SB - #49,,"42.961015","-81.217334",,,,,,false,"7",Inner_City_South
ADELLEA3,"50",Adelaide north of Leathorne 1 NB - #50,,"42.962904","-81.220032",,,,,,false,"7",Inner_City_South
ADELLEA5,"52",Adelaide north of Leathorne 2 NB - #52,,"42.963991","-81.220618",,,,,,false,"7",Inner_City_South
ADELMAUD,"56",Adelaide at Maud NB - #56,,"42.970708","-81.223681",,,,,,false,"7",Inner_City_South
ADELTERR,"81",Adelaide at Terrace NB - #81,,"42.972963","-81.224651",,,,,,false,"7",Inner_City_South
ADELTHO1,"82",Adelaide at Thompson NB - #82,,"42.968564","-81.222737",,,,,,false,"7",Inner_City_South
ADELTHO2,"83",207 Adelaide - #83,,"42.964134","-81.220869",,,,,,false,"7",Inner_City_South
ADELTHO4,"84",Adelaide at Thompson SB - #84,,"42.967775","-81.222568",,,,,,false,"7",Inner_City_South
ADELTHO6,"85",155 Adelaide SB - #85,,"42.965996","-81.221812",,,,,,false,"7",Inner_City_South
ADELTHO8,"86",247 Adelaide SB - #86,,"42.962455","-81.219962",,,,,,false,"7",Inner_City_South
BASEDUND,"184",Base Line at Dundee Place EB - #184,,"42.959601","-81.25735",,,,,,false,"7",Inner_City_South
BASEFAI2,"189",Base Line west of Fairview Ave WB - #189,,"42.962147","-81.226993",,,,,,false,"7",Inner_City_South
BASEFAI3,"190",Base Line west of Fairview EB - #190,,"42.962039","-81.226664",,,,,,false,"7",Inner_City_South
BASEHIG1,"192",Base Line at High EB - #192,,"42.961362","-81.235476",,,,,,false,"7",Inner_City_South
BASEWEL1,"206",Base Line east of Wellington EB - #206,,"42.961772","-81.230042",,,,,,false,"7",Inner_City_South
BASEWEL3,"208",Base Line west of Wellington EB - #208,,"42.961636","-81.231553",,,,,,false,"7",Inner_City_South
BASEWEL6,"210",Base Line west of Wellington WB - #210,,"42.961786","-81.231501",,,,,,false,"7",Inner_City_South
BRUCMARL,"303",Bruce at Marley Place EB - #303,,"42.972934","-81.251357",,,,,,false,"7",Inner_City_South
BRUCWORT,"304",Bruce at Wortley EB - #304,,"42.972448","-81.253366",,,,,,false,"7",Inner_City_South
BURLCAIR,"312",Burlington at Cairn EB - #312,,"42.963624","-81.203471",,,,,,false,"7",Inner_City_South
BURLPOMI,"313",Burlington at Pond Mills EB - #313,,"42.963336","-81.201285",,,,,,false,"7",Inner_City_South
CARFCAR1,"323",Carfrae at Carfrae NB - #323,,"42.974211","-81.245171",,,,,,false,"7",Inner_City_South
CARFCAR2,"324",Carfrae & Carfrae St SB - #324,,"42.974234","-81.245255",,,,,,false,"7",Inner_City_South
CARFGRAN,"325",Carfrae at Grand NB - #325,,"42.971887","-81.244635",,,,,,false,"7",Inner_City_South
CARFWOOD,"326",Carfrae at Woodland Pl SB - #326,,"42.972115","-81.244794",,,,,,false,"7",Inner_City_South
CATHBASE,"331",Cathcart at Baseline NB - #331,,"42.960272","-81.253127",,,,,,false,"7",Inner_City_South
CATHDEVO,"334",Cathcart at Devonshire NB - #334,,"42.963072","-81.253339",,,,,,false,"7",Inner_City_South
CATHELMW,"336",Cathcart at Elmwood NB - #336,,"42.970601","-81.254468",,,,,,false,"7",Inner_City_South
CATHLANG,"339",Cathcart at Langarth NB - #339,,"42.965372","-81.253657",,,,,,false,"7",Inner_City_South
CATHTECU,"340",Cathcart at Tecumseh NB - #340,,"42.967892","-81.254039",,,,,,false,"7",Inner_City_South
COMMADE1,"445",Commissioners at Adelaide EB - #445,,"42.959153","-81.2149",,,,,,false,"7",Inner_City_South
COMMADE2,"446",Commissioners east of Adelaide WB - #446,,"42.959517","-81.214417",,,,,,false,"7",Inner_City_South
COMMADE4,"447",Commissioners west of Adelaide WB - #447,,"42.958643","-81.220485",,,,,,false,"7",Inner_City_South
COMMDEV2,"450",Commissioners west of Deveron 1 WB - #450,,"42.962337","-81.195987",,,,,,false,"7",Inner_City_South
COMMDEV4,"452",Commissioners west of Deveron 2 WB - #452,,"42.962191","-81.1969",,,,,,false,"7",Inner_City_South
COMMDEV6,"453",Commissioners east of Deveron WB - #453,,"42.962645","-81.193643",,,,,,false,"7",Inner_City_South
COMMFRO1,"454",Commissioners at Frontenac EB - #454,,"42.960312","-81.20809",,,,,,false,"7",Inner_City_South
COMMFRO2,"455",Commissioners at Frontenac WB - #455,,"42.960331","-81.209188",,,,,,false,"7",Inner_City_South
COMMKIE1,"462",Commissioners at King Edward EB - #462,,"42.960762","-81.205452",,,,,,false,"7",Inner_City_South
COMMKIE2,"463",Commissioners at King Edward WB - #463,,"42.960842","-81.205928",,,,,,false,"7",Inner_City_South
COMMLEA1,"464",Commissioners at Leathorne EB - #464,,"42.959597","-81.212585",,,,,,false,"7",Inner_City_South
COMMLEA2,"465",Commissioners at Leathorne WB - #465,,"42.95983","-81.212451",,,,,,false,"7",Inner_City_South
COMMPOM1,"475",Commissioners west of Pondmills EB - #475,,"42.961323","-81.201406",,,,,,false,"7",Inner_City_South
COMMPOM3,"477",Commissioners east of Pondmills EB - #477,,"42.961925","-81.197476",,,,,,false,"7",Inner_City_South
COMMPOM4,"478",Commissioners west of Pondmills WB - #478,,"42.9615","-81.20151",,,,,,false,"7",Inner_City_South
EDWABASE,"630",Edward at Baseline SB - #630,,"42.959872","-81.256607",,,,,,false,"7",Inner_City_South
EDWAELMW,"634",Edward at Elmwood SB - #634,,"42.970163","-81.257901",,,,,,false,"7",Inner_City_South
EDWAHIWY,"637",Edward at Highway SB - #637,,"42.962174","-81.256749",,,,,,false,"7",Inner_City_South
EDWALANG,"639",Edward at Langarth SB - #639,,"42.965432","-81.257158",,,,,,false,"7",Inner_City_South
EDWATECU,"640",Edward at Tecumseh SB - #640,,"42.96804","-81.257575",,,,,,false,"7",Inner_City_South
ELMWCATH,"641",Elmwood at Cathcart WB - #641,,"42.970779","-81.254355",,,,,,false,"7",Inner_City_South
ELMWMARL,"642",Elmwood at Marley Place WB - #642,,"42.971201","-81.250563",,,,,,false,"7",Inner_City_South
ELMWWORT,"643",Elmwood at Wortley WB - #643,,"42.970934","-81.252723",,,,,,false,"7",Inner_City_South
GRANHIG1,"790",Grand at High EB - #790,,"42.971973","-81.240767",,,,,,false,"7",Inner_City_South
GRANHIG2,"791",Grand at High WB - #791,,"42.972112","-81.24004",,,,,,false,"7",Inner_City_South
GRANHIG4,"792",84 Grand WB - #792,,"42.971894","-81.241983",,,,,,false,"7",Inner_City_South
HIGHBASE,"930",High at Baseline NB - #930,,"42.961578","-81.236142",,,,,,false,"7",Inner_City_South
HIGHCHE1,"931",High at Chester NB - #931,,"42.963971","-81.236823",,,,,,false,"7",Inner_City_South
HIGHCHE2,"932",High at Chester SB - #932,,"42.963761","-81.236863",,,,,,false,"7",Inner_City_South
HIGHEME1,"933",High at Emery NB - #933,,"42.965409","-81.237156",,,,,,false,"7",Inner_City_South
HIGHEME2,"934",High at Emery SB - #934,,"42.965776","-81.237322",,,,,,false,"7",Inner_City_South
HIGHGRA2,"936",High at Grand SB - #936,,"42.9716","-81.238813",,,,,,false,"7",Inner_City_South
HIGHMCL1,"937",High at McClary NB - #937,,"42.971092","-81.238544",,,,,,false,"7",Inner_City_South
HIGHWIN2,"940",High at Windsor Cres SB - #940,,"42.968769","-81.238034",,,,,,false,"7",Inner_City_South
HIGHWIN3,"941",High at Windsor Cres NB - #941,,"42.968628","-81.237928",,,,,,false,"7",Inner_City_South
KINGBUR1,"1077",King Edward at Burlington NB - #1077,,"42.962132","-81.20638",,,,,,false,"7",Inner_City_South
KINGCHI1,"1078",King Edward at Chippendale NB - #1078,,"42.964116","-81.208154",,,,,,false,"7",Inner_City_South
KINGCHI2,"1079",King Edward at Chippendale SB - #1079,,"42.964385","-81.20833",,,,,,false,"7",Inner_City_South
KINGEAGL,"1082",King Edward at Eagle SB - #1082,,"42.963123","-81.207767",,,,,,false,"7",Inner_City_South
KINGECHO,"1083",King Edward at Echo SB - #1083,,"42.966097","-81.209213",,,,,,false,"7",Inner_City_South
KINGSCE1,"1087",King Edward at Scenic NB - #1087,,"42.967366","-81.210686",,,,,,false,"7",Inner_City_South
KINGSCE2,"1088",King Edward at Scenic SB - #1088,,"42.967282","-81.210728",,,,,,false,"7",Inner_City_South
KINGTHO2,"1089",King Edward at Thompson SB - #1089,,"42.969234","-81.212795",,,,,,false,"7",Inner_City_South
KINGVERM,"1090",King Edward at Vermont Ave NB - #1090,,"42.965959","-81.208889",,,,,,false,"7",Inner_City_South
PONDAILS,"1399",Pond Mills at Ailsa SB - #1399,,"42.970378","-81.204489",,,,,,false,"7",Inner_City_South
PONDBURL,"1406",Pond Mills at Burlington Gate NB - #1406,,"42.963757","-81.201037",,,,,,false,"7",Inner_City_South
PONDCLE1,"1407",Pond Mills at Cleveland NB - #1407,,"42.96746","-81.202057",,,,,,false,"7",Inner_City_South
PONDCLE2,"1408",Pond Mills at Cleveland SB - #1408,,"42.967599","-81.202236",,,,,,false,"7",Inner_City_South
PONDCOMM,"1409",Pond Mills at Commissioners NB - #1409,,"42.962133","-81.200663",,,,,,false,"7",Inner_City_South
PONDEGER,"1412",Pond Mills at Thompson NB - #1412,,"42.97274","-81.209805",,,,,,false,"7",Inner_City_South
PONDSCE1,"1421",Pond Mills at Scenic NB - #1421,,"42.971897","-81.207463",,,,,,false,"7",Inner_City_South
PONDSCE4,"1422",Pond Mills south of Scenic SB - #1422,,"42.971741","-81.207216",,,,,,false,"7",Inner_City_South
RIDOBAKE,"1531",Ridout at Baker NB - #1531,,"42.967407","-81.246257",,,,,,false,"7",Inner_City_South
RIDOBAS1,"1532",Ridout at Baseline NB - #1532,,"42.960517","-81.242718",,,,,,false,"7",Inner_City_South
RIDOBAS2,"1533",Ridout at Baseline SB - #1533,,"42.961246","-81.243171",,,,,,false,"7",Inner_City_South
RIDOCRA1,"1537",Ridout at Craig NB - #1537,,"42.974264","-81.249696",,,,,,false,"7",Inner_City_South
RIDOCRA2,"1538",Ridout at Craig SB - #1538,,"42.974335","-81.249832",,,,,,false,"7",Inner_City_South
RIDOELMW,"1539",Ridout at Elmwood SB - #1539,,"42.972601","-81.248939",,,,,,false,"7",Inner_City_South
RIDOEME1,"1540",Ridout at Emery NB - #1540,,"42.964715","-81.244873",,,,,,false,"7",Inner_City_South
RIDOEME2,"1541",Ridout at Emery SB - #1541,,"42.965227","-81.245179",,,,,,false,"7",Inner_City_South
RIDOGRAN,"1544",Ridout & Grand Ave NB - #1544,,"42.971431","-81.248245",,,,,,false,"7",Inner_City_South
RIDOHICK,"1545",Ridout at Hickson NB - #1545,,"42.962205","-81.243574",,,,,,false,"7",Inner_City_South
RIDOING1,"1547",Ridout at Ingleside NB - #1547,,"42.975851","-81.250566",,,,,,false,"7",Inner_City_South
RIDOMOU2,"1553",Ridout at Mountsfiled SB - #1553,,"42.959504","-81.242285",,,,,,false,"7",Inner_City_South
RIDOROSE,"1554",Ridout at Rosel SB - #1554,,"42.962909","-81.244023",,,,,,false,"7",Inner_City_South
RIDOTEC1,"1555",Ridout at Tecumseh NB - #1555,,"42.969427","-81.247221",,,,,,false,"7",Inner_City_South
RIDOTEC2,"1556",Ridout at Tecumseh SB - #1556,,"42.969589","-81.247432",,,,,,false,"7",Inner_City_South
RIDOWINS,"1557",Ridout at Windsor SB - #1557,,"42.967104","-81.246159",,,,,,false,"7",Inner_City_South
SHELBUR2,"1656",Shelborne at Burlington Gate SB - #1656,,"42.963197","-81.200141",,,,,,false,"7",Inner_City_South
SHELDEVE,"1657",Shelborne at Deveron EB - #1657,,"42.963077","-81.196346",,,,,,false,"7",Inner_City_South
STANPERR,"1758",Stanley at Perry EB - #1758,,"42.978172","-81.259762",,,,,,false,"7",Inner_City_South
STANWHAR,"1759",Stanley at Wharncliffe EB - #1759,,"42.977719","-81.261462",,,,,,false,"7",Inner_City_South
STANWORT,"1760",Stanley at Wortley EB - #1760,,"42.978927","-81.257107",,,,,,false,"7",Inner_City_South
THOMADE1,"1776",Princess Elizabeth Elementary School EB - #1776,,"42.968377","-81.221932",,,,,,false,"7",Inner_City_South
THOMADE2,"1777",Thompson at Adelaide WB - #1777,,"42.968275","-81.223112",,,,,,false,"7",Inner_City_South
THOMCHE1,"1779",Thompson at Chesterfield  EB - #1779,,"42.969255","-81.216183",,,,,,false,"7",Inner_City_South
THOMCHE2,"1780",Thompson at Chesterfield  WB - #1780,,"42.969298","-81.21699",,,,,,false,"7",Inner_City_South
THOMEME1,"1781",Thompson at Emerson  EB - #1781,,"42.968937","-81.219792",,,,,,false,"7",Inner_City_South
THOMGLA1,"1783",Thompson at Gladstone Ave EB - #1783,,"42.969382","-81.21484",,,,,,false,"7",Inner_City_South
THOMGLA2,"1784",Thompson at GladstoneWB - #1784,,"42.969463","-81.214921",,,,,,false,"7",Inner_City_South
THOMJACQ,"1785",Thompson at Jacqueline WB - #1785,,"42.969025","-81.2199",,,,,,false,"7",Inner_City_South
THOMKED1,"1786",Thompson at King Edward EB - #1786,,"42.96964","-81.212344",,,,,,false,"7",Inner_City_South
THOMKED2,"1787",Thompson at King Edward  WB - #1787,,"42.969612","-81.213279",,,,,,false,"7",Inner_City_South
VICTCOMM,"1854",Victoria Hospital at Commissioners NB - #1854,,"42.959454","-81.223182",,,,,,false,"7",Inner_City_South
VICTLOT9,"1855",Victoria Hospital Cancer Centre SB - #1855,,"42.959952","-81.228915",,,,,,false,"7",Inner_City_South
VICTMUBU,"1856",Victoria Hospital at Medical Unit Building - #1856,,"42.961257","-81.221941",,,,,,false,"7",Inner_City_South
VICTWES1,"1857",Victoria Hospital at Western Counties EB - #1857,,"42.959117","-81.223662",,,,,,false,"7",Inner_City_South
VICTZONB,"1859",Victoria Hospital & Baseline Rd Ent WB - #1859,,"42.961443","-81.226937",,,,,,false,"7",Inner_City_South
WELLALEX,"1922",Wellington & Alexandra St NB - #1922,,"42.967398","-81.232396",,,,,,false,"7",Inner_City_South
WELLBAS1,"1923",Wellington South of Baseline NB - #1923,,"42.961193","-81.230777",,,,,,false,"7",Inner_City_South
WELLBAS2,"1924",Wellington at Baseline SB - #1924,,"42.961977","-81.231306",,,,,,false,"7",Inner_City_South
WELLBOND,"1925",Wellington at Bond  NB - #1925,,"42.968858","-81.234644",,,,,,false,"7",Inner_City_South
WELLCHES,"1929",Wellington at Chester NB - #1929,,"42.96436","-81.231661",,,,,,false,"7",Inner_City_South
